<SmestajnaJedinica xmlns="www.model.megatravel.project.com/accomodation" xmlns:xsi="http://www.w3.org/2001/XMLSchema-instance" id="7" xsi:schemaLocation="https://www.model.megatravel.project.com/accomodation schemas/SmestajSema.xsd">
    <brojKreveta>3</brojKreveta>
    <balkon>true</balkon>
    <sObjekat>4</sObjekat>
    <opis>Prostrana soba dovoljno velika da se 3 odrasle osobe komotno smeste.</opis>
    <otkazivanje>
        <dozvoljeno>false</dozvoljeno>
        <brojDana>0</brojDana>
        <faktorOtkazivanja>0.0</faktorOtkazivanja>
    </otkazivanje>
    <oznaka>Soba 101</oznaka>
</SmestajnaJedinica>