<SmestajnaJedinica xmlns="www.model.megatravel.project.com/accomodation" xmlns:xsi="http://www.w3.org/2001/XMLSchema-instance" id="9" xsi:schemaLocation="https://www.model.megatravel.project.com/accomodation schemas/SmestajSema.xsd">
    <brojKreveta>5</brojKreveta>
    <balkon>true</balkon>
    <sObjekat>4</sObjekat>
    <opis>Prostrani apartman sa dve zasebne sobe.</opis>
    <otkazivanje>
        <dozvoljeno>true</dozvoljeno>
        <brojDana>5</brojDana>
        <faktorOtkazivanja>0.0</faktorOtkazivanja>
    </otkazivanje>
    <oznaka>Soba 105</oznaka>
</SmestajnaJedinica>
